{
  "$schema": "https://json-schema.org/draft/2020-12/schema",
  "type": "object",
  "additionalProperties": false,
  "required": ["schema_version", "order_id", "hypothesis_id", "report_mode", "evidence_tier", "edge_claim", "decision", "provenance", "v4_controls_sha256", "canonical_sections", "universes", "weekly_schedule", "paired_weeks", "symbol_sessions", "validation_seal", "authorizations", "producing_checkout"],
  "properties": {
    "schema_version": {"const": "lily_l4_b84_preflight_report_v1"}, "order_id": {"const": "B8.4"}, "hypothesis_id": {"const": "L-4"}, "report_mode": {"const": "synthetic_preflight_only"}, "evidence_tier": {"const": "E0"}, "edge_claim": {"const": "none"}, "decision": {"const": "not_run"},
    "provenance": {"type": "object", "additionalProperties": false, "required": ["v4_path", "v4_sha256", "v4_validator_path", "v4_validator_sha256", "v4_manifest_identity", "b84_gate_path", "b84_gate_sha256", "b84_gate_validator_path", "b84_gate_validator_sha256", "b84_manifest_identity", "b84_implementation"], "properties": {"v4_path": {"type": "string"}, "v4_sha256": {"type": "string"}, "v4_validator_path": {"type": "string"}, "v4_validator_sha256": {"type": "string"}, "v4_manifest_identity": {"type": "object"}, "b84_gate_path": {"type": "string"}, "b84_gate_sha256": {"type": "string"}, "b84_gate_validator_path": {"type": "string"}, "b84_gate_validator_sha256": {"type": "string"}, "b84_manifest_identity": {"type": "object"}, "b84_implementation": {"type": "object", "additionalProperties": false, "required": ["runner", "report_validator", "report_schema", "shared_preflight_library"], "properties": {"runner": {"type": "object"}, "report_validator": {"type": "object"}, "report_schema": {"type": "object"}, "shared_preflight_library": {"type": "object"}}}}},
    "v4_controls_sha256": {"type": "string"},
    "canonical_sections": {"type": "object", "additionalProperties": false, "required": ["mandatory_metrics", "statistics", "regime_matrix", "robustness_and_side_effects", "timing_and_seal", "universes", "static_capacity", "decision_contract"], "properties": {"mandatory_metrics": {"type": "string"}, "statistics": {"type": "string"}, "regime_matrix": {"type": "string"}, "robustness_and_side_effects": {"type": "string"}, "timing_and_seal": {"type": "string"}, "universes": {"type": "string"}, "static_capacity": {"type": "string"}, "decision_contract": {"type": "string"}}},
    "universes": {"type": "object", "additionalProperties": false, "required": ["U1", "U4", "U8"], "properties": {"U1": {"type": "array"}, "U4": {"type": "array"}, "U8": {"type": "array"}}}, "weekly_schedule": {"type": "string"}, "paired_weeks": {"type": "integer", "minimum": 0, "maximum": 465},
    "symbol_sessions": {"type": "object", "additionalProperties": false, "required": ["VTI", "VGK", "EWJ", "VWO", "IEF", "TIP", "GLD", "DBC"], "properties": {"VTI": {"type": "array"}, "VGK": {"type": "array"}, "EWJ": {"type": "array"}, "VWO": {"type": "array"}, "IEF": {"type": "array"}, "TIP": {"type": "array"}, "GLD": {"type": "array"}, "DBC": {"type": "array"}}},
    "validation_seal": {"const": {"status": "sealed_not_accessed", "accessed": false}},
    "authorizations": {"type": "object", "additionalProperties": false, "required": ["data", "container", "market", "return", "signal", "position", "covariance", "regime", "cost", "pnl", "execution", "report_decision", "ledger", "validation", "provider", "network", "credentials", "broker", "paid", "paper_trade", "real_money"], "properties": {"data": {"const": false}, "container": {"const": false}, "market": {"const": false}, "return": {"const": false}, "signal": {"const": false}, "position": {"const": false}, "covariance": {"const": false}, "regime": {"const": false}, "cost": {"const": false}, "pnl": {"const": false}, "execution": {"const": false}, "report_decision": {"const": false}, "ledger": {"const": false}, "validation": {"const": false}, "provider": {"const": false}, "network": {"const": false}, "credentials": {"const": false}, "broker": {"const": false}, "paid": {"const": false}, "paper_trade": {"const": false}, "real_money": {"const": false}}},
    "producing_checkout": {"type": "object", "additionalProperties": false, "required": ["mode", "validating_checkout_commit"], "properties": {"mode": {"const": "committed_synthetic_fixture"}, "validating_checkout_commit": {"type": "string", "anyOf": [{"const": "runtime_head_required"}, {"pattern": "^[0-9a-f]{40}$"}]}}}
  }
}
