{"schema_version":"lily_l4_b84_preflight_report_v1","order_id":"B8.4","hypothesis_id":"L-4","report_mode":"synthetic_preflight_only","evidence_tier":"E0","edge_claim":"none","decision":"not_run","provenance":{"v4_path":"experiments/l_4_breadth_preregistration_v4.json","v4_sha256":"648b480aed523074e8c99646b313c70b074ca6bde95c2a30fb88a128d150ffcb","v4_validator_path":"scripts/validate_l_4_breadth_preregistration_v4.py","v4_validator_sha256":"78bd4553ca0145d78f2408b0a325fe630897cc717495c6a60766fd72b9a42a42","v4_manifest_identity":{"gate_id":"l_4_breadth_v4","artifact_path":"experiments/l_4_breadth_preregistration_v4.json","artifact_sha256":"648b480aed523074e8c99646b313c70b074ca6bde95c2a30fb88a128d150ffcb","validator_path":"scripts/validate_l_4_breadth_preregistration_v4.py","validator_sha256":"78bd4553ca0145d78f2408b0a325fe630897cc717495c6a60766fd72b9a42a42"},"b84_gate_path":"experiments/l_4_breadth_b84_activation_contract_v1.json","b84_gate_sha256":"65108e4eddc9aeaf0f8de98fe5c1e1bfe232d77e696af249655e394403974536","b84_gate_validator_path":"scripts/validate_l_4_breadth_b84_activation_contract_v1.py","b84_gate_validator_sha256":"fd6ba6bc2e6420637b4d3964f6941676f253a409790db245fe7caacb5810b2e9","b84_manifest_identity":{"gate_id":"l_4_breadth_b84_activation_contract_v1","artifact_path":"experiments/l_4_breadth_b84_activation_contract_v1.json","artifact_sha256":"65108e4eddc9aeaf0f8de98fe5c1e1bfe232d77e696af249655e394403974536","validator_path":"scripts/validate_l_4_breadth_b84_activation_contract_v1.py","validator_sha256":"fd6ba6bc2e6420637b4d3964f6941676f253a409790db245fe7caacb5810b2e9"},"b84_implementation":{"report_schema":{"path":"schemas/l_4_breadth_b84_preflight_report_v1.schema.json","sha256":"ec9023a186f8dca946425f7ca4050796725ffaf007d97bdf863b3e328db4088b"},"shared_preflight_library":{"path":"lib/l4_b84_preflight.py","sha256":"dc1fe03c5196e3b6791b4c6698b62357a035b5627f769386422acdcbc83594cf"},"report_validator":{"path":"scripts/validate_l_4_breadth_b84_preflight_report_v1.py","sha256":"6d61a91783887e863718397479bb922cbb801bdd504b2c1366969d15711c1850"},"runner":{"path":"scripts/run_l_4_breadth_b84_preflight_v1.py","sha256":"72eb6d7c55b448f84f3beb28a7ee84d3672648f89c39c6ec261aad001c4a08a9"}}},"v4_controls_sha256":"b5ea69224a6e3fc9a3245f19031e19cd52dd3c8c59069db9c224e1f6953a1938","canonical_sections":{"mandatory_metrics":"63f0f818455163d420d72bded22315d055f48e2b4622bd70b47012221952fde7","statistics":"a85d5d38379d1eb1b72232a203b48befcc175da7f383f2480bae32f6963b8837","regime_matrix":"e6191ece97def96d61a68682f2ab4f8d032935867beef08a34a93d20fcfe7c20","robustness_and_side_effects":"858475c0bba10a15e34d1dbebaac5bb3c5161b6ee4c47931dcc3a2f085904161","timing_and_seal":"b88d16fdddde29da0c27f4fe481eec1fd591bb23af324f7442f4f84abeec8917","universes":"84078db452d2cfb26a499785a571f0e4fcf65568a0f6faf0d16f023ec8abd309","static_capacity":"bc6540e409611488f1f27cc8a8c2a4e299dc61a771d25530a55343b47d04c205","decision_contract":"9389c7d1b194cdb644ae093cebbf57627237cddefe4b8196896d30c45e6966bf"},"universes":{"U1":["VTI"],"U4":["VTI","IEF","GLD","DBC"],"U8":["VTI","VGK","EWJ","VWO","IEF","TIP","GLD","DBC"]},"weekly_schedule":"synthetic U8-common weekly schedule only; no return decoding or validation dates","paired_weeks":0,"symbol_sessions":{"VTI":["2015-12-31"],"VGK":["2015-12-31"],"EWJ":["2015-12-31"],"VWO":["2015-12-31"],"IEF":["2015-12-31"],"TIP":["2015-12-31"],"GLD":["2015-12-31"],"DBC":["2015-12-31"]},"validation_seal":{"status":"sealed_not_accessed","accessed":false},"producing_checkout":{"mode":"committed_synthetic_fixture","validating_checkout_commit":"runtime_head_required"},"authorizations":{"data":false,"container":false,"market":false,"return":false,"signal":false,"position":false,"covariance":false,"regime":false,"cost":false,"pnl":false,"execution":false,"report_decision":false,"ledger":false,"validation":false,"provider":false,"network":false,"credentials":false,"broker":false,"paid":false,"paper_trade":false,"real_money":false}}
